{"schemaVersion":"1.0.0","kind":"review-receipt","identity":"sha256:4ef85709f8cb46f7882da1002cf1073f7f1ae182ae0d3ffc1be539077a1cbd18","baseCommit":"6304c90f83df3cdb918dff03f6358dcf4a939d16","headCommit":"43113d9000000000000000000000000000000000","treeId":"2222222222222222222222222222222222222222","patchSha256":"sha256:4444444444444444444444444444444444444444444444444444444444444444","reviewerFamily":"anthropic","outcome":"PASS","findingCount":0,"artifactHash":"sha256:5555555555555555555555555555555555555555555555555555555555555555","createdAt":"2026-10-07T05:00:00Z"}
